{
  "allowed_evidence_artifact_paths": [],
  "allowed_gate_ids": [
    "browser_read_only_worker_policy_v1",
    "browser_worker_adapter_contract_v1",
    "browser_read_only_signed_approval_guard_v1",
    "browser_read_only_apply_preflight_blocker_v1",
    "browser_read_only_apply_command_contract_v1",
    "agent_egress_event_ledger_v1"
  ],
  "allowed_scope": "egress_route_preflight_only:browser_read_only_gateway",
  "approval_is_not_apply": true,
  "browser_session_start_allowed": false,
  "decision": "approve_route_preflight_only",
  "decision_id": "egress-route-guard-positive-browser-preflight-only",
  "egress_type": "browser_read_only",
  "expires_utc": "2099-01-01T00:00:00Z",
  "external_side_effects": false,
  "gateway_registration_allowed": false,
  "gateway_start_allowed": false,
  "live_egress_allowed": false,
  "mcp_tool_calls": false,
  "model_api_calls": false,
  "operator_attestation": "I approve egress route preflight review only and understand this does not register a gateway, start a gateway, start a worker, open a browser, call a model/API, call MCP, mutate service requests, or perform live egress.",
  "operator_id": "human-operator",
  "rollback_plan": "Discard generated report-only browser-read-only egress route decision artifacts; no gateway, worker, runtime, browser session, model/API, MCP, public action, account, wallet, payment, or external action was started.",
  "route_id": "browser_read_only_gateway",
  "runtime_boundary": {
    "account_actions": false,
    "apply_allowed": false,
    "approval_granted_by_contract": false,
    "approval_rows_written": 0,
    "browser_sessions_started": 0,
    "decision_authority_granted_by_contract": false,
    "decisions_applied": 0,
    "dependency_installs": 0,
    "external_side_effects": false,
    "gateway_registrations": 0,
    "gateway_starts": 0,
    "live_egress_events": 0,
    "mcp_tool_calls": false,
    "model_api_calls": false,
    "payment_actions": false,
    "public_actions": false,
    "report_only": true,
    "runtime_starts": 0,
    "security_testing_actions": false,
    "service_requests_assigned": 0,
    "service_requests_updated": 0,
    "telemetry_exports": 0,
    "wallet_actions": false,
    "worker_registrations": 0,
    "worker_starts": 0
  },
  "runtime_start_allowed": false,
  "schema_version": "agent_company.egress_route_signed_decision_intake_contract.v1",
  "service_requests_assigned": 0,
  "service_requests_updated": 0,
  "signed_utc": "2026-06-18T00:20:00Z",
  "source_gateway_docket_path": "E:\\agent-company-lab\\reports\\unified-agent-egress-gateway-docket-v1-20260618.json",
  "source_gateway_docket_sha256": "49fb5fa8ca17899a9eff5496a73a163cb9e7384ff9ad51948535ed8287d05028",
  "worker_registration_allowed": false,
  "worker_start_allowed": false
}
